{"candidate_identity_observed_at_utc":"2026-07-15T16:02:38.173239Z","capture_runner_sha256":"7dad8326b72a9e7795d5563cb58d72616d4883c4277eeb0c2c2427928f89a28d","created_at_utc":"2026-07-15T16:03:26.221535Z","environment":{"packages":{"jsonschema":"4.26.0","rapidfuzz":"3.14.5","torch":"2.12.1","transformers":"5.12.1"},"platform":"Linux-7.0.9-arch2-1-x86_64-with-glibc2.43","python":"3.12.13","uv":"uv 0.11.28 (x86_64-unknown-linux-gnu)"},"evidence_id":"stage3-verification-v1-20260715T160326Z","full_test_suite":{"combined_output":"................................................................................................................................\n----------------------------------------------------------------------\nRan 128 tests in 41.366s\n\nOK\n","combined_output_policy":"stdout_bytes_then_stderr_bytes","combined_output_sha256":"4deaa41627df2f86cf41553bdb347f286237bc3312cc90ebe6ad87724d058bce","command":"uv run --frozen python -m unittest discover -s tests","completed_at_utc":"2026-07-15T16:03:26.212082Z","duration_seconds":43.042795845998626,"exit_status":0,"implementation_sha256":"440b12f7df15b74c046dd1350648e251e5a208312342795f964d910ca2fa6ce2","result":"pass","started_at_utc":"2026-07-15T16:02:43.169278Z","stderr":"................................................................................................................................\n----------------------------------------------------------------------\nRan 128 tests in 41.366s\n\nOK\n","stderr_sha256":"4deaa41627df2f86cf41553bdb347f286237bc3312cc90ebe6ad87724d058bce","stdout":"","stdout_sha256":"e3b0c44298fc1c149afbf4c8996fb92427ae41e4649b934ca495991b7852b855"},"ordinary_verifier":{"combined_output":"{\n  \"asset_sha256\": {\n    \"contamination_calibration\": \"242d4fae46d975ca31d80c8765e2b9dae9521665c1fc5e9855970e148d1a626b\",\n    \"evaluation_generation_manifest_schema\": \"de4dace5ada6904f72b7b99fd83a3edfb350d6311fc028f232720d9571ee3652\",\n    \"heldout_freeze_bundle_schema\": \"7f8237b81beefa60a56887a2f3aea06febfef8c84169fdb99b01458a1581a680\",\n    \"heldout_prompt_schema\": \"e1f80752d4f0f9f8dbe7da100e77f4c7c05afc59f89831f2280436883fc30dbc\",\n    \"heldout_replacement_schema\": \"2d5a6bb6aa7e4d4a8b35a1a72ecc9e5b72ba0c52cee9162576991b70fe25b9f6\",\n    \"judge_calibration\": \"46ef76c16073998843045ed99221f67a18b6b61b737f939236436f2f393668f9\",\n    \"judge_manifest\": \"3a6344e1e09509a04101040161d417a3ab2cb1b82ad2da51e81be74b550f2c35\",\n    \"pairwise_judgment_schema\": \"a63779463e114393026ff10971033c9f6d2bd47c2e2803a0f4c94ccc574df7a6\",\n    \"prompt_overlap_review_schema\": \"06cd97517c81a788c856ace52b546e0796c6441fcfc922fe41ac1a91de24bb0b\",\n    \"protocol\": \"95e1dcd0e4caf7e08715ab02f922725c05e11ba557fd785732792c1a6b26535c\",\n    \"protocol_schema\": \"f27ef6c3e4b638580c0770ba22458022b8cac5f603c8442bc20f85e6afd77d81\",\n    \"qualitative_judgment_schema\": \"3825255798b349eae63fa82d7d1bbb3c5d969dbcc5d8c7cca7a84a5db73f6009\",\n    \"response_similarity_calibration\": \"d156c5fd5a846fc37ccef73a41b805388569d9facbcc76ace181fc3e96631ccf\",\n    \"response_similarity_evidence_schema\": \"41cb6878a2bc63746dff1e4f66c6e9cf335fe6808ef8f4a7b075212ec2c503d0\",\n    \"response_similarity_review_schema\": \"3a481d63611f8a9ef64f9ef87b935699b000a858d10b48ed2afea4eee301dbf9\",\n    \"review_artifact_schema\": \"b80b2b410acd971e4226febc42c341aab7afe1672b864d3dbbff619c9a23c854\",\n    \"rubric\": \"710e18fc26e0563594164e1517de0e9c30914b7908e5265d617c1489d705ecbd\",\n    \"source_identity_schema\": \"fe14f4d2bce3822817e3399a44aae34dde527756bb4a1b5d585d3dc5e61332f1\",\n    \"stage3_verification_evidence_schema\": \"7d1e950ade1b84dbe9ced7f82488103080a7914b73571cfd7c4531bffebc849f\",\n    \"stage5_semantic_review_schema\": \"915856ab033c285c4712774f893640e4f6801b237ee4a7d0adac955144e9442f\",\n    \"withheld_domain_check_schema\": \"dae73313b84a0a856402b5c1bc4e41c03867d7c287e304821c040574db021490\"\n  },\n  \"calibration\": {\n    \"case_count\": 12,\n    \"case_types\": {\n      \"acceptable_shared_domain\": 1,\n      \"acceptable_shared_operation\": 1,\n      \"acceptable_shared_robustness_mechanism\": 1,\n      \"acceptable_shared_task_form\": 1,\n      \"borderline_changed_situation\": 1,\n      \"close_paraphrase\": 1,\n      \"creative_brief_paraphrase\": 1,\n      \"disguised_scenario_duplicate\": 1,\n      \"exact_duplicate\": 1,\n      \"supplied_code_paraphrase\": 1,\n      \"supplied_text_over_256_wordpieces\": 1,\n      \"surface_substitution\": 1\n    },\n    \"result\": \"pass\"\n  },\n  \"judge_calibration\": {\n    \"focus\": [\n      \"behaviour_pressure\",\n      \"compatible_content_constraint\",\n      \"dimension_boundary\",\n      \"format_pressure\",\n      \"pairwise_preference\",\n      \"pairwise_tie\"\n    ],\n    \"packet_count\": 6,\n    \"result\": \"pass\"\n  },\n  \"judge_manifest_sha256\": \"3a6344e1e09509a04101040161d417a3ab2cb1b82ad2da51e81be74b550f2c35\",\n  \"protocol_id\": \"chatgnt-evaluation-v1\",\n  \"protocol_manifest\": {\n    \"aggregate_sha256\": \"d0f8b186210062a86f313611968ade7a8de089e2fb25de99e9c61c235ec9a236\",\n    \"asset_count\": 52,\n    \"manifest_sha256\": \"9296a7308f64db49d77df1328554df6e6552423046984eea6f0e567a083adedb\",\n    \"protocol_normative_sha256\": \"9db43df16c74e2e44c7a244d6777d4363c1de2be2198fdf5d6145748342c45ad\",\n    \"result\": \"pass\"\n  },\n  \"protocol_sha256\": \"95e1dcd0e4caf7e08715ab02f922725c05e11ba557fd785732792c1a6b26535c\",\n  \"response_similarity_calibration\": {\n    \"case_count\": 2,\n    \"hard_distractor_count\": 2,\n    \"result\": \"pass\"\n  },\n  \"result\": \"pass\",\n  \"retrieval_calibration\": {\n    \"case_count\": 12,\n    \"interpretation\": \"retrieval recall is a diagnostic; semantic collision decisions remain human-readable judgments\",\n    \"lexical_expected_match_recall_at_5\": 1.0,\n    \"semantic\": {\n      \"executed\": false,\n      \"expected_match_recall_at_5\": null\n    }\n  },\n  \"status\": \"review_candidate\"\n}\n","combined_output_policy":"stdout_bytes_then_stderr_bytes","combined_output_sha256":"6b872fa0a96cbb7807ea8438406e8f0033cd07b0dd8a812afff6a97f03657ef6","command":"uv run --frozen python scripts/verify_evaluation_protocol.py","completed_at_utc":"2026-07-15T16:02:38.468144Z","duration_seconds":0.2940770419991168,"exit_status":0,"implementation_sha256":"b9feb48b6375bf5e783a157d3b6ab115a574b065a2d46b925fe3681e8ab1b85f","result":"pass","started_at_utc":"2026-07-15T16:02:38.174055Z","stderr":"","stderr_sha256":"e3b0c44298fc1c149afbf4c8996fb92427ae41e4649b934ca495991b7852b855","stdout":"{\n  \"asset_sha256\": {\n    \"contamination_calibration\": \"242d4fae46d975ca31d80c8765e2b9dae9521665c1fc5e9855970e148d1a626b\",\n    \"evaluation_generation_manifest_schema\": \"de4dace5ada6904f72b7b99fd83a3edfb350d6311fc028f232720d9571ee3652\",\n    \"heldout_freeze_bundle_schema\": \"7f8237b81beefa60a56887a2f3aea06febfef8c84169fdb99b01458a1581a680\",\n    \"heldout_prompt_schema\": \"e1f80752d4f0f9f8dbe7da100e77f4c7c05afc59f89831f2280436883fc30dbc\",\n    \"heldout_replacement_schema\": \"2d5a6bb6aa7e4d4a8b35a1a72ecc9e5b72ba0c52cee9162576991b70fe25b9f6\",\n    \"judge_calibration\": \"46ef76c16073998843045ed99221f67a18b6b61b737f939236436f2f393668f9\",\n    \"judge_manifest\": \"3a6344e1e09509a04101040161d417a3ab2cb1b82ad2da51e81be74b550f2c35\",\n    \"pairwise_judgment_schema\": \"a63779463e114393026ff10971033c9f6d2bd47c2e2803a0f4c94ccc574df7a6\",\n    \"prompt_overlap_review_schema\": \"06cd97517c81a788c856ace52b546e0796c6441fcfc922fe41ac1a91de24bb0b\",\n    \"protocol\": \"95e1dcd0e4caf7e08715ab02f922725c05e11ba557fd785732792c1a6b26535c\",\n    \"protocol_schema\": \"f27ef6c3e4b638580c0770ba22458022b8cac5f603c8442bc20f85e6afd77d81\",\n    \"qualitative_judgment_schema\": \"3825255798b349eae63fa82d7d1bbb3c5d969dbcc5d8c7cca7a84a5db73f6009\",\n    \"response_similarity_calibration\": \"d156c5fd5a846fc37ccef73a41b805388569d9facbcc76ace181fc3e96631ccf\",\n    \"response_similarity_evidence_schema\": \"41cb6878a2bc63746dff1e4f66c6e9cf335fe6808ef8f4a7b075212ec2c503d0\",\n    \"response_similarity_review_schema\": \"3a481d63611f8a9ef64f9ef87b935699b000a858d10b48ed2afea4eee301dbf9\",\n    \"review_artifact_schema\": \"b80b2b410acd971e4226febc42c341aab7afe1672b864d3dbbff619c9a23c854\",\n    \"rubric\": \"710e18fc26e0563594164e1517de0e9c30914b7908e5265d617c1489d705ecbd\",\n    \"source_identity_schema\": \"fe14f4d2bce3822817e3399a44aae34dde527756bb4a1b5d585d3dc5e61332f1\",\n    \"stage3_verification_evidence_schema\": \"7d1e950ade1b84dbe9ced7f82488103080a7914b73571cfd7c4531bffebc849f\",\n    \"stage5_semantic_review_schema\": \"915856ab033c285c4712774f893640e4f6801b237ee4a7d0adac955144e9442f\",\n    \"withheld_domain_check_schema\": \"dae73313b84a0a856402b5c1bc4e41c03867d7c287e304821c040574db021490\"\n  },\n  \"calibration\": {\n    \"case_count\": 12,\n    \"case_types\": {\n      \"acceptable_shared_domain\": 1,\n      \"acceptable_shared_operation\": 1,\n      \"acceptable_shared_robustness_mechanism\": 1,\n      \"acceptable_shared_task_form\": 1,\n      \"borderline_changed_situation\": 1,\n      \"close_paraphrase\": 1,\n      \"creative_brief_paraphrase\": 1,\n      \"disguised_scenario_duplicate\": 1,\n      \"exact_duplicate\": 1,\n      \"supplied_code_paraphrase\": 1,\n      \"supplied_text_over_256_wordpieces\": 1,\n      \"surface_substitution\": 1\n    },\n    \"result\": \"pass\"\n  },\n  \"judge_calibration\": {\n    \"focus\": [\n      \"behaviour_pressure\",\n      \"compatible_content_constraint\",\n      \"dimension_boundary\",\n      \"format_pressure\",\n      \"pairwise_preference\",\n      \"pairwise_tie\"\n    ],\n    \"packet_count\": 6,\n    \"result\": \"pass\"\n  },\n  \"judge_manifest_sha256\": \"3a6344e1e09509a04101040161d417a3ab2cb1b82ad2da51e81be74b550f2c35\",\n  \"protocol_id\": \"chatgnt-evaluation-v1\",\n  \"protocol_manifest\": {\n    \"aggregate_sha256\": \"d0f8b186210062a86f313611968ade7a8de089e2fb25de